{
  "$schema": "https://json-schema.org/draft/2020-12/schema",
  "type": "object",
  "properties": {
    "schemaVersion": {
      "const": 1
    },
    "id": {
      "type": "string",
      "pattern": "^[a-z0-9]+(?:-[a-z0-9]+)*$",
      "maxLength": 64
    },
    "version": {
      "type": "string",
      "pattern": "^(0|[1-9][0-9]*)\\.(0|[1-9][0-9]*)\\.(0|[1-9][0-9]*)$"
    },
    "label": {
      "type": "string",
      "pattern": "\\S"
    },
    "source": {
      "type": "object",
      "properties": {
        "designation": {
          "type": "string",
          "pattern": "\\S"
        },
        "isbn": {
          "type": "string",
          "pattern": "\\S"
        },
        "sha256": {
          "type": "string",
          "pattern": "^[A-F0-9]{64}$"
        }
      },
      "required": ["designation", "isbn", "sha256"],
      "additionalProperties": false
    },
    "templates": {
      "type": "array",
      "items": {
        "type": "object",
        "properties": {
          "id": {
            "type": "string",
            "pattern": "^[a-z0-9]+(?:-[a-z0-9]+)*$",
            "maxLength": 64
          },
          "version": {
            "type": "string",
            "pattern": "^(0|[1-9][0-9]*)\\.(0|[1-9][0-9]*)\\.(0|[1-9][0-9]*)$"
          }
        },
        "required": ["id", "version"],
        "additionalProperties": false
      },
      "minItems": 1
    }
  },
  "required": ["schemaVersion", "id", "version", "label", "source", "templates"],
  "additionalProperties": false
}
